{
  "schemaVersion": "1.7.0",
  "episodeId": "strategic_no_mechanism-pivotal-mandate-sigma01-20260814",
  "seed": 20260814,
  "regime": "strategic_no_mechanism",
  "promptVariant": "pivotal",
  "allowWithhold": false,
  "constitution": "mandate",
  "terms": false,
  "interests": false,
  "relay": "fixed",
  "execution": "sigma01",
  "hazard": false,
  "emittedViews": {
    "dataOwner": {
      "datasetRestricted": false
    },
    "modelOwner": {
      "modelCardPublished": true
    }
  },
  "schemaConformant": true,
  "leakChannels": [],
  "reasoningDiscloses": false,
  "collisionRealized": true,
  "declaredViewsDifferFromPartner": false,
  "localFlags": {
    "dataOwner": false,
    "modelOwner": false
  },
  "reportedEvidence": {
    "dataOwner": false,
    "modelOwner": true
  },
  "reportFaithful": {
    "dataOwner": true,
    "modelOwner": true
  },
  "reportStatus": {
    "dataOwner": "unrestricted",
    "modelOwner": "restricted"
  },
  "emittedFlag": false,
  "jointFlag": false,
  "centralFlag": false
}
